"Cooks, private household    * Certified Personal Chef* Personal Chef* Private Chef","=""35-2013""","40.9","41.8","0.9","2.1","6.1","32,630","Postsecondary nondegree award","5","Less than 5 years","2","None","6"
"Cooks, restaurant    * Banquet Cook* Breakfast Cook* Chef De Partie* Line Cook* Saucier* Specialty Cook","=""35-2014""","1,153.2","1,716.7","563.5","48.9","263.6","28,800","No formal educational credential","8","Less than 5 years","2","Moderate-term on-the-job training","4"
"Cooks, short order    * Griddle Attendant* Griddle Cook* Grill Cook* Short Order Fry Cook* Snack Bar Cook","=""35-2015""","124.5","136.4","11.9","9.6","20.0","26,570","No formal educational credential","8","None","4","Short-term on-the-job training","5"
"Cooling and freezing equipment operators and tenders    * Ammonia Refrigeration Worker* Chiller Operator* Chiller Tender* Freezer Operator* Refrigerating Machine Operator* Refrigeration Operator","=""51-9193""","8.4","8.9","0.5","6.0","1.0","37,650","High school diploma or equivalent","7","None","4","Moderate-term on-the-job training","4"
"Correctional officers and jailers    * Certified Detention Deputy* Convict Guard* Correction Officer* Correctional Guard* Correctional Sergeant* Detention Deputy* Detention Officer* Jail Guard* Juvenile Corrections Officer* Penal Officer* Prison Guard* Prison Officer","=""33-3012""","418.5","388.5","-30.0","-7.2","34.0","47,410","High school diploma or equivalent","7","None","4","Moderate-term on-the-job training","4"
"Correspondence clerks    * Claims Correspondence Clerk* Correspondence Clerk* Correspondence Representative* Correspondence Transcriber* Customer Service Correspondence Clerk* Fan Mail Editor* Medicare Correspondence Representative* Student Loan Correspondent","=""43-4021""","7.0","6.8","-0.2","-2.9","0.7","38,400","High school diploma or equivalent","7","None","4","Short-term on-the-job training","5"
"Cost estimators    * Construction Estimator* Construction Job Cost Estimator* Crating and Moving Estimator* Electrical Estimator* Job Estimator* Production Cost Estimator","=""13-1051""","199.4","200.6","1.2","0.6","17.8","66,610","Bachelor's degree","3","None","4","Moderate-term on-the-job training","4"
"Costume attendants    * Costume Attendant* Theatrical Wardrobe Attendant* Theatrical Wardrobe Dresser* Wardrobe Assistant* Wardrobe Attendant* Wardrobe Custodian* Wardrobe Dresser* Wardrobe Supervisor","=""39-3092""","5.4","7.7","2.4","44.3","1.6","42,910","High school diploma or equivalent","7","None","4","Short-term on-the-job training","5"
"Counselors, all other    * AIDS Counselor* Anger Control Counselor* Grief Counselor* HIV Counselor* Sexual Assault Counselor","=""21-1019""","54.3","59.2","4.8","8.9","5.7","45,760","Master's degree","2","None","4","None","6"
"Counter and rental clerks    * Airplane Charter Clerk* Apartment Rental Clerk* Automobile Rental Clerk* Bicycle Rental Clerk* Boat Rental Clerk* Car Rental Agent* Dry Cleaning Counter Clerk* Layaway Clerk* Rental Clerk* Storage Facility Rental Clerk* Video Rental Clerk","=""41-2021""","372.1","401.5","29.4","7.9","46.8","30,870","No formal educational credential","8","None","4","Short-term on-the-job training","5"
"Couriers and messengers    * Bank Courier* Bicycle Messenger* Courier* Court Messenger* Laboratory Courier* Office Messenger* Office Runner","=""43-5021""","142.2","130.5","-11.7","-8.2","11.8","30,980","High school diploma or equivalent","7","None","4","Short-term on-the-job training","5"
"Court reporters and simultaneous captioners","=""27-3092""","21.3","21.8","0.5","2.5","2.1","61,660","Postsecondary nondegree award","5","None","4","Short-term on-the-job training","5"
"Court, municipal, and license clerks    * Circuit Court Clerk* City Clerk* Court Clerk* Courtroom Clerk* Deputy Court Clerk* Docket Clerk* Dog Licenser* License Clerk* Motor Vehicle License Clerk* Motor Vehicle Representative* Municipal Clerk* Tax Clerk* Township Clerk* Warrant Clerk","=""43-4031""","162.1","171.6","9.5","5.8","17.5","40,930","High school diploma or equivalent","7","None","4","Long-term on-the-job training","3"
"Craft artists    * Furniture Artist* Hand Potter* Metal Arts Production Artist* Quilter","=""27-1012""","9.6","10.9","1.3","13.2","1.2","35,180","No formal educational credential","8","None","4","Long-term on-the-job training","3"
"Crane and tower operators    * Boom Crane Operator* Bridge Crane Operator* Cherry Picker Operator* Coal Tower Operator* Electric Crane Operator* Erecting Crane Operator* Monorail Crane Operator* Overhead Crane Operator* Port Crane Operator* Radio Control Crane Operator* Scrap Crane Operator* Tower Loader Operator* Woodyard Crane Operator","=""53-7021""","44.8","47.2","2.4","5.4","5.0","59,710","High school diploma or equivalent","7","Less than 5 years","2","Moderate-term on-the-job training","4"
"Credit analysts    * Chief Credit Analyst* Credit Analyst* Credit Assessment Analyst* Credit Risk Analyst* Factorer","=""13-2041""","73.0","68.8","-4.3","-5.8","5.5","74,970","Bachelor's degree","3","None","4","None","6"
"Credit authorizers, checkers, and clerks    * Charge Authorizer* Commercial Credit Reviewer* Credit Authorizer* Credit Charge Authorizer* Credit Checker* Credit Investigator* Credit Processor* Credit Rating Checker* Credit Reference Clerk* Credit Report Checker","=""43-4041""","25.3","24.1","-1.2","-4.8","2.3","41,730","High school diploma or equivalent","7","None","4","Moderate-term on-the-job training","4"
"Credit counselors    * Credit Counselor* Debt Management Counselor* Financial Assistance Advisor* Loan Counselor","=""13-2071""","33.8","36.9","3.0","9.0","3.0","46,170","Bachelor's degree","3","None","4","Moderate-term on-the-job training","4"
"Crematory operators and personal care and service workers, all other","=""39-9098""","80.5","100.5","19.9","24.8","13.9","28,420","High school diploma or equivalent","7","None","4","Short-term on-the-job training","5"
"Criminal justice and law enforcement teachers, postsecondary    * Criminal Justice Professor* Criminology Professor* Penology Professor","=""25-1111""","16.1","17.9","1.8","11.1","1.7","63,560","Doctoral or professional degree","1","None","4","None","6"
"Crossing guards and flaggers    * Construction Site Crossing Guard* Crossing Guard* School Crossing Guard* School Traffic Guard","=""33-9091""","85.5","97.0","11.5","13.4","19.1","30,790","No formal educational credential","8","None","4","Short-term on-the-job training","5"
"Crushing, grinding, and polishing machine setters, operators, and tenders    * Beveling and Edging Machine Operator* Beveller Operator* Blanchard Grinder Operator* Crusher Plant Operator* Cullet Crusher and Washer* Industrial Coffee Grinder* Marble and Granite Polisher* Mix Crusher Operator* Pulverizer Operator","=""51-9021""","32.6","32.5","-0.1","-0.4","3.5","39,370","High school diploma or equivalent","7","None","4","Moderate-term on-the-job training","4"
"Curators    * Collections Curator* Collections and Archives Director* Curator* Educational Institution Curator* Exhibitions and Collections Manager* Herbarium Curator* Museum Curator* Photography and Prints Curator","=""25-4012""","13.4","16.3","2.9","21.6","1.9","56,990","Master's degree","2","None","4","None","6"
"Customer service representatives    * Complaint Clerk* Contact Center Specialist* Customer Complaint Clerk* Customer Contact Specialist* Customer Relations Representative* Customer Support Representative* Gas Distribution and Emergency Clerk* Passenger Relations Representative* Policyholder Information Clerk* Warranty Clerk","=""43-4051""","2,923.4","2,888.8","-34.5","-1.2","361.7","35,830","High school diploma or equivalent","7","None","4","Short-term on-the-job training","5"
"Cutters and trimmers, hand    * Fur Trimmer* Hand Cloth Cutter* Hand Fabric Cutter* Portable Machine Cutter","=""51-9031""","8.1","5.7","-2.4","-29.7","0.6","31,630","No formal educational credential","8","None","4","Short-term on-the-job training","5"
"Cutting and slicing machine setters, operators, and tenders    * Dog Food Shredder Operator* Glass Cutting Machine Operator* Insulation Cutter* Paper Cutter* Paper Slitter* Rubber Trimmer* Shearing Machine Tender* Trimming Operator","=""51-9032""","53.6","51.7","-1.9","-3.5","6.2","36,980","High school diploma or equivalent","7","None","4","Moderate-term on-the-job training","4"
"Cutting, punching, and press machine setters, operators, and tenders, metal and plastic    * Crimping Machine Operator for Metal* Four Slide Machine Setter* Metal Punch Press Operator* Metal Slitter* Metal Stamper","=""51-4031""","182.0","177.5","-4.5","-2.4","17.6","36,980","High school diploma or equivalent","7","None","4","Moderate-term on-the-job training","4"
"Dancers    * Ballerina* Ballet Company Member* Ballet Dancer* Ballet Soloist* Burlesque Dancer* Dance Artist* Dancer* Discotheque Dancer* Exotic Dancer* Go-Go Dancer* Line Dancer* Soft Shoe Dancer* Tap Dancer","=""27-2031""","9.0","11.7","2.7","30.0","1.9","N/A","No formal educational credential","8","None","4","Long-term on-the-job training","3"
"Data entry keyers    * Customs Entry Clerk* Data Entry Clerk* Data Input Clerk* Data Keyer* Data Processing Clerk* Data Typist* Key Punch Operator* Keypunch Operator* Keypuncher","=""43-9021""","158.4","122.8","-35.6","-22.5","11.6","34,440","High school diploma or equivalent","7","None","4","Short-term on-the-job training","5"
"Data scientists and mathematical science occupations, all other","=""15-2098""","63.2","83.0","19.8","31.4","7.1","98,230","Bachelor's degree","3","None","4","None","6"
"Database administrators and architects","=""15-1245""","168.0","181.2","13.2","7.8","13.9","98,860","Bachelor's degree","3","None","4","None","6"
"Demonstrators and product promoters    * Home Demonstrator* Home Service Demonstrator* Hostess Party Sales Representative* In-Store Demonstrator","=""41-9011""","76.3","81.9","5.6","7.3","14.6","32,500","No formal educational credential","8","None","4","Short-term on-the-job training","5"
"Dental assistants    * Certified Dental Assistant* Dental Aide* Dental Assistant* Expanded Functions Dental Assistant* Orthodontic Assistant* Orthodontist Assistant* Registered Dental Assistant* Surgical Dental Assistant","=""31-9091""","330.2","367.0","36.9","11.2","44.0","41,180","Postsecondary nondegree award","5","None","4","None","6"
"Dental hygienists","=""29-1292""","206.1","229.2","23.1","11.2","15.6","77,090","Associate's degree","4","None","4","None","6"
"Dental laboratory technicians    * Crown Ceramist* Crown and Bridge Dental Lab Technician* Crown and Bridge Technician* Dental Ceramist* Dental Laboratory Worker* Dental Mold Maker* Dental Technician* Orthodontic Technician","=""51-9081""","33.1","37.2","4.0","12.2","4.9","42,110","High school diploma or equivalent","7","None","4","Moderate-term on-the-job training","4"
"Dentists, all other specialists    * Endodontist* Maxillofacial Pathology* Oral Pathologist* Pediatric Dentist* Pedodontist* Periodontist* Public Health Dentist","=""29-1029""","6.8","7.1","0.3","5.0","0.2","183,300","Doctoral or professional degree","1","None","4","Internship/residency","1"
"Dentists, general    * Family Dentist","=""29-1021""","120.3","130.0","9.8","8.1","4.3","158,940","Doctoral or professional degree","1","None","4","None","6"
"Derrick operators, oil and gas    * Derrick Operator* Gas Derrick Operator* Oil Derrick Operator* Rotary Derrick Operator* Well Service Derrick Worker","=""47-5011""","9.0","11.7","2.7","29.7","1.5","47,920","No formal educational credential","8","None","4","Short-term on-the-job training","5"
"Designers, all other    * Memorial Marker Designer","=""27-1029""","31.6","31.6","0.0","0.1","2.8","63,750","Bachelor's degree","3","None","4","None","6"
"Desktop publishers    * DTP Operator* Desktop Publisher* Desktop Publishing Specialist* Electronic Console Display Operator* Electronic Imager* Electronic Pagination System Operator* Electronic Publisher* Electronic Publishing Specialist","=""43-9031""","8.2","7.2","-1.0","-12.3","0.8","47,560","Associate's degree","4","None","4","Short-term on-the-job training","5"
"Detectives and criminal investigators    * Criminal Investigator* Deputy United States Marshal* FBI Investigator* Homicide Detective* Narcotics Detective* Narcotics Investigator* Police Detective","=""33-3021""","112.5","115.3","2.8","2.5","8.4","86,940","High school diploma or equivalent","7","Less than 5 years","2","Moderate-term on-the-job training","4"
"Diagnostic medical sonographers    * Cardiac/Vascular Sonographer* Diagnostic Medical Sonographer* Registered Diagnostic Medical Sonographer* Sonographer* Ultrasonographer* Ultrasound Technician* Ultrasound Technologist","=""29-2032""","75.9","90.3","14.4","19.0","7.3","75,920","Associate's degree","4","None","4","None","6"
"Dietetic technicians    * Clinical Dietetic Technician* Cook Chill Technician* DTR* Dietary Aide* Dietary Technician* Dietetic Technician* Nutrition Technician* Registered Diet Technician","=""29-2051""","26.8","28.8","2.0","7.4","2.2","30,110","Associate's degree","4","None","4","None","6"
"Dietitians and nutritionists    * Clinical Dietitian* Dietitian* Nutritionist* Pediatric Dietician* Public Health Dietitian* Public Health Nutritionist* Research Dietitian* Sports Nutritionist* Therapeutic Dietitian","=""29-1031""","73.0","80.8","7.8","10.7","5.9","63,090","Bachelor's degree","3","None","4","Internship/residency","1"
"Dining room and cafeteria attendants and bartender helpers    * Banquet Set Up Person* Bar Back* Barback* Buffet Attendant* Bus Person* Busser* Lunchroom Attendant","=""35-9011""","389.0","492.5","103.6","26.6","86.5","25,010","No formal educational credential","8","None","4","Short-term on-the-job training","5"
"Directors, religious activities and education    * Campus Ministry Director* Christian Education Minister* Education Minister* Parish Religious Education Director* Religious Activities Director* Religious Education Coordinator* Religious Education Director* Student Ministries Director* Youth Ministry Director","=""21-2021""","149.6","152.8","3.2","2.2","17.4","45,110","Bachelor's degree","3","Less than 5 years","2","None","6"
"Dishwashers    * Dish Room Worker* Dishwasher* Silverware Cleaner","=""35-9021""","408.5","486.3","77.8","19.0","78.8","25,270","No formal educational credential","8","None","4","Short-term on-the-job training","5"
"Dispatchers, except police, fire, and ambulance    * Airplane Dispatch Clerk* Auto Service Dispatcher* Bus Dispatcher* Crew Dispatcher* Maintenance Dispatcher* School Bus Dispatcher* Taxicab Dispatcher* Tow Truck Dispatcher* Train Dispatcher* Truck Dispatcher","=""43-5032""","192.1","200.4","8.3","4.3","18.7","40,980","High school diploma or equivalent","7","None","4","Moderate-term on-the-job training","4"
"Door-to-door sales workers, news and street vendors, and related workers    * Newspaper Carrier* Newstand Vendor* Peddler* Souvenir Street Vendor","=""41-9091""","54.0","41.0","-13.0","-24.1","4.7","29,730","No formal educational credential","8","None","4","Short-term on-the-job training","5"
"Drafters, all other    * Blueprint Tracer* Drafting Layout Worker* Draughtsman* Geological Drafter* Marine Drafter","=""17-3019""","14.4","13.6","-0.8","-5.4","1.2","54,500","Associate's degree","4","None","4","None","6"
"Dredge operators    * Dredge Deckhand* Dredge Engineer* Dredge Mate* Dredge Operator* Dredger","=""53-7031""","2.0","2.1","0.1","5.2","0.3","49,210","High school diploma or equivalent","7","None","4","Moderate-term on-the-job training","4"
"Drilling and boring machine tool setters, operators, and tenders, metal and plastic    * Bore Mill Operator for Plastic* Boring Mill Operator for Metal* Drill Press Operator for Metal* Horizontal Boring Mill Operator for Metal* Radial Drill Operator for Plastic* Radial Drill Press Operator for Plastic* Reaming Machine Operator for Plastic","=""51-4032""","9.1","7.7","-1.4","-15.5","0.7","39,780","High school diploma or equivalent","7","None","4","Moderate-term on-the-job training","4"
"Driver/sales workers    * Bakery Deliverer* Bobtailer* Delivery Sales worker* Newspaper Deliverer* Newspaper Delivery Driver* Pizza Delivery Driver* Route Sales Person* Route Salesperson* Sales Route Driver","=""53-3031""","458.2","540.0","81.9","17.9","62.5","27,960","High school diploma or equivalent","7","None","4","Short-term on-the-job training","5"
"Drywall and ceiling tile installers    * Acoustical Ceiling Installer* Drywall Applicator* Drywall Finisher* Drywall Hanger* Drywall Installer* Drywall Sander* Drywall Stripper* Drywall Worker* Sheet Rock Applier* Sheet Rock Hanger* Sheet Rock Installer* Sheet Rock Worker","=""47-2081""","121.2","127.2","6.0","4.9","10.7","47,460","No formal educational credential","8","None","4","Moderate-term on-the-job training","4"
"Earth drillers, except oil and gas; and explosives workers, ordnance handling experts, and blasters","=""47-5097""","23.2","25.1","1.8","8.0","3.0","48,510","High school diploma or equivalent","7","Less than 5 years","2","Long-term on-the-job training","3"
"Economics teachers, postsecondary    * Agricultural Economics Professor* Econometrics Professor* Industrial Economics Professor* Labor Economics Professor* Macroeconomics Professor* Microeconomics Professor","=""25-1063""","16.0","17.4","1.4","9.0","1.7","107,260","Doctoral or professional degree","1","None","4","None","6"
"Economists    * Agricultural Economist* Econometrician* Economic Development Specialist* Economic Research Analyst* Economist* Environmental Economist* Industrial Economist* Labor Economist* Price Economist* Social Economist* Tax Economist* Trade Economist","=""19-3011""","18.6","21.0","2.4","13.1","1.6","108,350","Master's degree","2","None","4","None","6"
"Editors    * Advertising Editor* Art Editor* Book Editor* Copy Desk Chief* Copy Editor* Index Editor* Manuscript Editor* Newspaper Photo Editor* Publications Editor* Rewrite Editor* Scientific Publications Editor* Sports Editor* Technical Editor","=""27-3041""","108.6","114.1","5.6","5.1","11.2","63,400","Bachelor's degree","3","Less than 5 years","2","None","6"
"Education administrators, all other","=""11-9039""","50.5","56.9","6.4","12.6","4.5","87,580","Bachelor's degree","3","Less than 5 years","2","None","6"
"Education administrators, kindergarten through secondary    * Elementary School Principal* High School Principal* Junior High School Principal* K-12 School Principal* K-8 School Principal* Middle School Principal* Secondary School Principal","=""11-9032""","270.2","291.3","21.2","7.8","22.1","98,490","Master's degree","2","5 years or more","1","None","6"
"Education administrators, postsecondary    * Adult Basic Education Manager* Continuing Education Director* Graduate School Dean* Graduate Studies Dean* Provost* University Administrator* University Dean","=""11-9033""","178.8","192.2","13.4","7.5","14.5","97,500","Master's degree","2","Less than 5 years","2","None","6"
"Education and childcare administrators, preschool and daycare    * Childcare Center Administrator* Childcare Center Director* Early Head Start Director* Head Start Director* Prekindergarten Program Coordinator* Preschool Director","=""11-9031""","60.8","67.7","6.9","11.4","5.3","49,160","Bachelor's degree","3","Less than 5 years","2","None","6"
"Education teachers, postsecondary    * Counselor Education Professor* Literacy Education Professor* Mathematics Education Professor* Primary Education Professor* Science Education Professor* Secondary Education Professor* Special Education Professor","=""25-1081""","70.0","75.8","5.8","8.3","7.2","65,440","Doctoral or professional degree","1","Less than 5 years","2","None","6"
"Educational instruction and library workers, all other    * General Educational Development (GED) Examiner* Individualized Education Plan (IEP) Aide* Scholastic Aptitude Test (SAT) Grader","=""25-9099""","157.0","169.5","12.5","8.0","16.4","41,570","Bachelor's degree","3","None","4","None","6"
"Educational, guidance, and career counselors and advisors    * Career Counselor* Career Technical Counselor* Education Counselor* International Student Counselor* School Adjustment Counselor* School Guidance Counselor* Student Advisor* Student Development Advisor* Student Services Counselor* Student Success Counselor* Study Abroad Advisor* Vocational Adviser","=""21-1012""","322.0","359.0","37.0","11.5","35.0","58,120","Master's degree","2","None","4","None","6"
"Electric motor, power tool, and related repairers    * AC/DC Rewinder* Armature Rewinder* Battery Repairer* Dynamo Repairer* Electric Motor Fitter* Electric Motor Rewinder* Electrical Parts Reconditioner","=""49-2092""","17.8","19.1","1.2","6.9","1.9","46,590","High school diploma or equivalent","7","Less than 5 years","2","Moderate-term on-the-job training","4"
"Electrical and electronic engineering technologists and technicians    * Electrical Design Technician* Electrical Engineering Technician* Electrical Power Station Technician* Electronic Instrument Testing Technician* Lighting Engineering Technician* Programmable Logic Controller Programmer* Semiconductor Development Technician","=""17-3023""","117.0","118.9","1.9","1.6","11.0","67,550","Associate's degree","4","None","4","None","6"
"Electrical and electronics drafters    * Circuit Board Drafter* Electrical Computer Aided Design and Drafting Technician* Electrical Drafter* Electrical Systems Drafter* Electronic Drafter* Printed Circuit Board Drafter","=""17-3012""","24.0","24.5","0.6","2.3","2.3","62,100","Associate's degree","4","None","4","None","6"
"Electrical and electronics installers and repairers, transportation equipment    * Locomotive Electrician* Marine Electronics Repairer* Marine Electronics Technician","=""49-2093""","9.1","9.7","0.6","6.7","0.8","70,200","Postsecondary nondegree award","5","None","4","Long-term on-the-job training","3"
"Electrical and electronics repairers, commercial and industrial equipment    * Industrial Aerial Installer* Industrial Robotics Mechanic* Missile Pad Mechanic* Public Address System Mechanic","=""49-2094""","56.4","59.0","2.5","4.5","4.7","62,010","Postsecondary nondegree award","5","None","4","Long-term on-the-job training","3"
"Electrical and electronics repairers, powerhouse, substation, and relay    * Generating Station Mechanic* Power Transformer Repairer* Powerhouse Electrician* Protective Relay Technician* Relay Technician* Substation Electrician* Substation Mechanic","=""49-2095""","23.1","22.5","-0.5","-2.4","1.7","85,340","Postsecondary nondegree award","5","Less than 5 years","2","Moderate-term on-the-job training","4"
"Electrical engineers    * Electrical Design Engineer* Electrical Engineer* Electrical Systems Engineer* Illuminating Engineer* Power Distribution Engineer","=""17-2071""","188.0","200.7","12.7","6.8","13.7","100,830","Bachelor's degree","3","None","4","None","6"
"Electrical power-line installers and repairers    * Electric Powerline Examiner* Electric Utility Lineworker* Electrical High Tension Tester* Electrical Lineworker* Power Lineworker* Underground Conduit Installer","=""49-9051""","115.9","117.4","1.5","1.3","10.2","75,030","High school diploma or equivalent","7","None","4","Long-term on-the-job training","3"
"Electrical, electronic, and electromechanical assemblers, except coil winders, tapers, and finishers","=""51-2028""","284.8","304.4","19.5","6.9","32.7","36,390","High school diploma or equivalent","7","None","4","Moderate-term on-the-job training","4"
"Electricians    * Chief Electrician* Control Electrician* Electrical Maintenance Worker* Electrical Sign Wirer* House Wirer* Licensed Electrician* Lighting Fixture Installer* Marine Electrician* Master Electrician* Solar Photovoltaic Electrician* Stage Electrician","=""47-2111""","729.6","795.7","66.1","9.1","84.7","56,900","High school diploma or equivalent","7","None","4","Apprenticeship","2"
"Electro-mechanical and mechatronics technologists and technicians    * Remotely Piloted Vehicle Engineering Technician* Robotics Testing Technician","=""17-3024""","13.4","13.1","-0.2","-1.7","1.2","59,800","Associate's degree","4","None","4","None","6"
"Electronic equipment installers and repairers, motor vehicles    * Auto Electrician* Auto Phone Installer* Auto Radio Mechanic* Automotive Electrician* Car Alarm Installer* Car Stereo Installer* GPS Car Navigation Installer* Mobile Electronics Installation Specialist","=""49-2096""","10.2","8.5","-1.6","-16.2","0.6","39,570","High school diploma or equivalent","7","None","4","Moderate-term on-the-job training","4"
"Electronics engineers, except computer    * Antenna Engineer* Circuit Design Engineer* Electronic Design Automation Engineer* Electronic Engineer* Electronic Parts Designer* Telecommunication Engineer","=""17-2072""","125.2","132.9","7.7","6.2","9.0","107,540","Bachelor's degree","3","None","4","None","6"
"Elementary school teachers, except special education    * 3rd Grade Reading Teacher* 4th Grade Math Teacher* Elementary School Band Director* Elementary School Teacher* Grades 1 Thru 5 Teacher","=""25-2021""","1,371.1","1,472.9","101.7","7.4","110.8","60,940","Bachelor's degree","3","None","4","None","6"
"Elevator and escalator installers and repairers    * Elevator Adjuster* Elevator Constructor* Elevator Installer* Elevator Mechanic* Elevator Repair and Maintenance Technician* Elevator Service Technician* Escalator Installer* Escalator Mechanic* Escalator Service Mechanic* Freight Elevator Erector* Hydraulic Elevator Constructor","=""47-4021""","24.8","26.3","1.5","6.1","2.5","88,540","High school diploma or equivalent","7","None","4","Apprenticeship","2"
