"Paving, surfacing, and tamping equipment operators    * Asphalt Paver* Asphalt Paving Machine Operator* Asphalt Roller Operator* Asphalt Tamping Machine Operator* Blacktop-Paver Operator* Paver Operator* Road Grader* Screed Operator","=""47-2071""","44.8","47.4","2.5","5.6","5.1","41,540","High school diploma or equivalent","7","None","4","Moderate-term on-the-job training","4"
"Payroll and timekeeping clerks    * Flight Crew Time Clerk* Payroll Bookkeeper* Personnel Scheduler* Time Clerk* Time and Attendance Clerk* Timekeeper","=""43-3051""","137.3","119.7","-17.7","-12.9","11.4","47,020","High school diploma or equivalent","7","None","4","Moderate-term on-the-job training","4"
"Pediatricians, general","=""29-1221""","30.2","29.6","-0.5","-1.8","0.8","177,130","Doctoral or professional degree","1","None","4","Internship/residency","1"
"Personal financial advisors    * Certified Financial Planner* Estate Planner* Estate Planning Counselor* Financial Counselor* Individual Pension Adviser* Individual Pension Consultant* Personal Financial Advisor* Personal Financial Planner* Personal Investment Adviser","=""13-2052""","275.2","287.8","12.6","4.6","21.5","89,330","Bachelor's degree","3","None","4","Long-term on-the-job training","3"
"Personal service managers, all other; entertainment and recreation managers, except gambling; and managers, all other","=""11-9198""","573.0","615.3","42.2","7.4","47.1","116,350","Bachelor's degree","3","Less than 5 years","2","None","6"
"Pest control workers    * Exterminator* Fumigator* Insecticide Expert* Mosquito Sprayer* Pest Controller* Rat Exterminator* Rodent Exterminator* Termite Technician* Termite Treater","=""37-2021""","86.8","95.0","8.2","9.5","12.8","37,820","High school diploma or equivalent","7","None","4","Moderate-term on-the-job training","4"
"Pesticide handlers, sprayers, and applicators, vegetation    * Certified Pesticide Applicator* Fruit Sprayer* Herbicide Sprayer* Orchard Sprayer* Plant Sprayer* Weed Sprayer","=""37-3012""","27.3","29.6","2.3","8.3","3.9","36,630","High school diploma or equivalent","7","None","4","Moderate-term on-the-job training","4"
"Petroleum engineers    * Natural Gas Engineer* Oil Drilling Engineer* Oil Exploration Engineer* Oil Well Engineer* Petroleum Engineer","=""17-2171""","28.5","30.7","2.2","7.6","2.1","137,330","Bachelor's degree","3","None","4","None","6"
"Petroleum pump system operators, refinery operators, and gaugers    * Hydrotreater Operator* Oil Gauger* Oil Pipeline Dispatcher* Oil Pipeline Operator* Oil Refiner* Petroleum Plant Operator* Petroleum Refinery Control Panel Operator* Petroleum Refinery Operator* Petroleum Refining Equipment Operator","=""51-8093""","40.6","42.8","2.3","5.6","4.4","78,840","High school diploma or equivalent","7","None","4","Moderate-term on-the-job training","4"
"Pharmacists    * Apothecary* Clinical Pharmacist* Druggist* Hospital Pharmacist* Registered Pharmacist","=""29-1051""","322.2","315.3","-7.0","-2.2","11.3","128,710","Doctoral or professional degree","1","None","4","None","6"
"Pharmacy aides    * Certified Pharmacist Assistant* Pharmacist Aide* Pharmacist Assistant* Pharmacy Assistant* Pharmacy Clerk* Prescription Clerk","=""31-9095""","38.9","33.2","-5.7","-14.7","4.1","29,280","High school diploma or equivalent","7","None","4","Short-term on-the-job training","5"
"Pharmacy technicians    * CPHT* Certified Pharmacy Technician* Pharmacist Technician* Pharmacy Laboratory Technician* Pharmacy Technician","=""29-2052""","419.3","435.9","16.6","4.0","31.7","35,100","High school diploma or equivalent","7","None","4","Moderate-term on-the-job training","4"
"Philosophy and religion teachers, postsecondary    * Biblical Studies Professor* Divinity Professor* Eastern Philosophy Professor* Old Testament Professor* Pastoral Ministries Professor* Religious Studies Professor* Theology Professor* Western Philosophy Professor","=""25-1126""","29.0","32.2","3.2","11.0","3.1","76,160","Doctoral or professional degree","1","None","4","None","6"
"Phlebotomists    * Certified Phlebotomy Technician* Phlebotomist* Phlebotomy Technician* Venipuncturist","=""31-9097""","129.6","158.4","28.8","22.2","19.5","36,320","Postsecondary nondegree award","5","None","4","None","6"
"Photographers    * Advertising Photographer* Aerial Photographer* Industrial Photographer* Marine Photographer* Medical Photographer* News Photographer* Newspaper Photojournalist* Photojournalist* Portrait Photographer* School Photographer* Wedding Photographer","=""27-4021""","110.5","129.4","18.9","17.1","12.7","41,280","High school diploma or equivalent","7","None","4","Moderate-term on-the-job training","4"
"Photographic process workers and processing machine operators    * Digital Imaging Technician* Digital Photo Printer* Digital Photo Technician* Digital Retoucher* Film Developing Machine Operator* Film Printer* Film Process Operator* Film Processor* Photo Lab Specialist* Photo Lab Technician* Photo Machine Operator* Photo Print Specialist* Photo Retoucher* Print Retoucher","=""51-9151""","9.3","8.5","-0.8","-8.7","1.3","34,720","High school diploma or equivalent","7","None","4","Short-term on-the-job training","5"
"Physical scientists, all other    * Physical Scientist","=""19-2099""","23.9","24.2","0.2","1.0","1.8","107,210","Bachelor's degree","3","None","4","None","6"
"Physical therapist aides    * Clinical Rehabilitation Aide* Physical Therapy Aide* Physiotherapy Aide","=""31-2022""","46.7","58.5","11.8","25.3","7.4","28,450","High school diploma or equivalent","7","None","4","Short-term on-the-job training","5"
"Physical therapist assistants    * LPTA* Licensed Physical Therapist Assistant* Physical Therapy Assistant* Physical Therapy Technician* Physiotherapy Assistant","=""31-2021""","93.8","126.9","33.2","35.4","16.4","59,770","Associate's degree","4","None","4","None","6"
"Physical therapists    * Cardiopulmonary Physical Therapist* Geriatric Physical Therapist* Orthopedic Physical Therapist* PT* Pediatric Physical Therapist* Physical Therapist* Physiotherapist* Pulmonary Physical Therapist* Sports Physical Therapist","=""29-1123""","239.2","288.3","49.1","20.5","15.6","91,010","Doctoral or professional degree","1","None","4","None","6"
"Physician assistants    * Anesthesiologist Assistant* Certified Physician's Assistant* Family Practice Physician Assistant* Orthopaedic Physician Assistant* Orthopedic Physician Assistant* Pediatric Physician Assistant* Radiology Practitioner Assistant* Surgical Physician Assistant","=""29-1071""","129.4","169.5","40.1","31.0","12.2","115,390","Master's degree","2","None","4","None","6"
"Physicians, all other; and ophthalmologists, except pediatric","=""29-1228""","412.1","430.8","18.7","4.5","13.4",">=208,000","Doctoral or professional degree","1","None","4","Internship/residency","1"
"Physicists    * Fluid Dynamicist* Health Physicist* Mathematical Physicist* Medical Physicist* Molecular Physicist* Nuclear Physicist* Optical Scientist* Research Physicist* Rheologist* Thermodynamic Physicist* Thermodynamicist","=""19-2012""","17.4","18.9","1.5","8.8","1.3","129,850","Doctoral or professional degree","1","None","4","None","6"
"Physics teachers, postsecondary    * Aerodynamics Professor* Astrophysics Professor* Atomic Physics Professor* Ballistics Professor* Hydrodynamics Professor* Medical Physics Professor* Nuclear Physics Professor* Physical Science Professor* Thermodynamics Professor","=""25-1054""","16.5","17.8","1.3","8.1","1.7","90,400","Doctoral or professional degree","1","None","4","None","6"
"Pile driver operators    * Diesel Pile Hammer Operator* Hydraulic Pile Hammer Operator* Hydraulic Press-In Operator* Pile Driver Operator* Vibratory Pile Driver","=""47-2072""","3.9","4.1","0.2","4.8","0.4","63,370","High school diploma or equivalent","7","None","4","Moderate-term on-the-job training","4"
"Pipelayers    * Cast-Iron Drain Pipe Layer* Pipe Layer* Sewer Pipe Layer* Trench Pipe Layer* Water Main Pipe Layer","=""47-2151""","35.1","34.5","-0.5","-1.5","3.5","40,480","No formal educational credential","8","None","4","Short-term on-the-job training","5"
"Plant and system operators, all other    * Asphalt Plant Operator* Concrete Batch Plant Operator* Lime Filter Operator* Sand Plant Attendant","=""51-8099""","14.9","15.4","0.5","3.1","1.6","58,960","High school diploma or equivalent","7","None","4","Moderate-term on-the-job training","4"
"Plasterers and stucco masons    * Dry Plasterer* Journey Level Plasterer* Molding Plasterer* Ornamental Plasterer* Plasterer Apprentice* Stucco Plasterer* Stucco Worker* Swimming Pool Plasterer","=""47-2161""","26.1","27.8","1.8","6.8","2.4","47,020","No formal educational credential","8","None","4","Long-term on-the-job training","3"
"Plating machine setters, operators, and tenders, metal and plastic    * Anodizer* Chrome Plater* Chromium Plater* Copper Plater* Electro Plater* Electrogalvanizing Machine Operator* Electroplater* Galvanizer* Hard Chrome Plater* Metal Plater* Metal Spraying Machine Operator* Metalizing Machine Operator* Nickel Plater* Plating Machine Operator* Tin Plater","=""51-4193""","39.3","38.2","-1.1","-2.7","3.8","34,850","High school diploma or equivalent","7","None","4","Moderate-term on-the-job training","4"
"Plumbers, pipefitters, and steamfitters    * Fire Sprinkler Installer* Gas Main Fitter* Gas Plumber* Hydraulic Plumber* Industrial Gas Fitter* Marine Pipefitter* Marine Steamfitter* Master Plumber* Pipe Fitter* Plumber* Solar Thermal Installer* Sprinkler Fitter* Steamfitter* Water Pump Installer","=""47-2152""","469.9","493.2","23.4","5.0","51.0","56,330","High school diploma or equivalent","7","None","4","Apprenticeship","2"
"Podiatrists    * Chiropodist* Doctor of Podiatric Medicine* Foot Doctor* Foot Orthopedist* Foot and Ankle Surgeon* Orthopedic Podiatrist* Podiatric Physician","=""29-1081""","12.1","12.3","0.2","1.8","0.9","134,300","Doctoral or professional degree","1","None","4","Internship/residency","1"
"Police and sheriff's patrol officers    * Border Guard* Border Patrol Officer* Constable* Cop* Deputy Sheriff* Highway Patrol Officer* Motorcycle Police* Mounted Police* Park Police* Patrol Officer* Policeman* Policewoman* State Highway Police Officer* State Trooper","=""33-3051""","671.2","719.8","48.6","7.2","57.6","65,540","High school diploma or equivalent","7","None","4","Moderate-term on-the-job training","4"
"Political science teachers, postsecondary    * Government Professor* International Relations Professor* Political Theory Professor* Public Policy Professor","=""25-1065""","18.4","20.0","1.6","8.7","1.9","85,760","Doctoral or professional degree","1","None","4","None","6"
"Political scientists    * Government Affairs Researcher* Government Affairs Specialist* Local Governance and Citizen Participation Specialist* Political Consultant* Political Research Scientist* Political Researcher","=""19-3094""","7.0","7.6","0.6","8.6","0.7","125,350","Master's degree","2","None","4","None","6"
"Postal service clerks    * Bulk Mail Clerk* Bulk Mail Technician* Parcel Post Clerk* Postal Clerk* Postal Service Clerk* Postal Service Window Clerk","=""43-5051""","82.8","76.4","-6.4","-7.8","5.8","50,150","High school diploma or equivalent","7","None","4","Short-term on-the-job training","5"
"Postal service mail carriers    * City Letter Carrier* Letter Carrier* Mail Deliverer* Parcel Post Carrier* Postal Mail Carrier* Rural Mail Carrier* Rural Route Carrier* USPS Letter Carrier","=""43-5052""","317.7","293.1","-24.7","-7.8","19.1","51,080","High school diploma or equivalent","7","None","4","Short-term on-the-job training","5"
"Postal service mail sorters, processors, and processing machine operators    * Flat Sorter Operator* Flat Sorting Machine Clerk* Mail Forwarding System Markup Clerk* Parcel Post Distribution Machine Operator* Post Office Markup Clerk* Postal Service Mail Processor* Small Package and Bundle Sorter Clerk","=""43-5053""","100.4","88.2","-12.2","-12.2","7.0","53,140","High school diploma or equivalent","7","None","4","Short-term on-the-job training","5"
"Postmasters and mail superintendents    * Postal Supervisor* Postmaster","=""11-9131""","13.2","12.2","-1.0","-7.7","0.8","78,060","High school diploma or equivalent","7","Less than 5 years","2","Moderate-term on-the-job training","4"
"Postsecondary teachers, all other    * Braille Teacher* Flight Simulator Teacher* Interdisciplinary Professor* Military Science Teacher* Project Management Professor","=""25-1199""","230.3","243.9","13.6","5.9","23.0","71,950","Doctoral or professional degree","1","None","4","None","6"
"Pourers and casters, metal    * Aluminum Pourer* Ingot Caster* Iron Pourer* Molten Iron Pourer* Steel Pourer* Tin Pourer* White Metal Caster","=""51-4052""","7.1","6.7","-0.4","-5.1","0.6","40,170","High school diploma or equivalent","7","None","4","Moderate-term on-the-job training","4"
"Power distributors and dispatchers    * Power System Dispatcher* Steam Plant Control Room Operator* Steam and Power Panel Operator* Substation Operator","=""51-8012""","10.0","9.3","-0.7","-7.3","0.8","95,100","High school diploma or equivalent","7","None","4","Long-term on-the-job training","3"
"Power plant operators    * Hydroelectric Plant Operator* Power Plant Control Room Operator* Powerhouse Operator* Turbine Room Attendant","=""51-8013""","33.6","29.0","-4.6","-13.6","2.5","84,650","High school diploma or equivalent","7","None","4","Long-term on-the-job training","3"
"Precision instrument and equipment repairers, all other    * Gyroscope Repairer* Hydrometer Calibrator* Scale Adjuster* Telescope Repairer","=""49-9069""","11.4","12.0","0.6","5.6","1.3","61,420","High school diploma or equivalent","7","None","4","Long-term on-the-job training","3"
"Prepress technicians and workers    * Digital Proofing and Platemaker* Electronic Pre-Press Technician* Photoengraver* Plate Mounter* Pre-Press Proofer* Prepress Stripper* Type Setter","=""51-5111""","28.2","23.3","-4.8","-17.1","3.0","41,410","Postsecondary nondegree award","5","None","4","None","6"
"Preschool teachers, except special education    * Early Childhood Teacher* Head Start Teacher* Nursery School Teacher* Nursery Teacher* Pre-K Teacher* Pre-Kindergarten Teacher* Preschool Teacher","=""25-2011""","469.6","556.0","86.4","18.4","59.6","31,930","Associate's degree","4","None","4","None","6"
"Pressers, textile, garment, and related materials    * Clothes Ironer* Clothes Presser* Clothing Presser* Garment Presser* Pants Presser* Shirt Presser* Silk Presser* Wool Presser","=""51-6021""","30.3","27.0","-3.3","-10.8","2.6","25,580","No formal educational credential","8","None","4","Short-term on-the-job training","5"
"Print binding and finishing workers    * Bindery Cutter Operator* Bindery Folder Operator* Bindery Machine Operator* Bindery Worker* Book Repairer* Bookbinder* Bookbinding Machine Operator* Case Binder Operator* Foil Stamp Operator* Perfect Binder Operator* Saddle Stitch Operator* Saddle Stitcher Operator* Spiral Binder Operator","=""51-5113""","41.6","34.4","-7.3","-17.5","3.5","34,260","High school diploma or equivalent","7","None","4","Moderate-term on-the-job training","4"
"Printing press operators    * Digital Press Operator* Flexographic Press Operator* Gravure Press Operator* Lithograph Press Operator* Lithographing Machine Operator* Offset Lithographic Press Setter and Set-Up Operator* Offset Press Operator* Printing Machine Operator* Screen Printing Machine Operator* Screen Printing Press Operator* Silk Screen Operator* Silk Screen Printer* Web Offset Press Feeder* Web Press Operator","=""51-5112""","160.9","144.9","-15.9","-9.9","14.7","37,880","High school diploma or equivalent","7","None","4","Moderate-term on-the-job training","4"
"Private detectives and investigators    * Certified Legal Investigator* Licensed Private Investigator* Loss Prevention Detective* Private Detective* Private Eye* Private Investigator* Skip Tracer* Store Detective","=""33-9021""","33.7","38.1","4.4","13.2","3.5","53,320","High school diploma or equivalent","7","Less than 5 years","2","Moderate-term on-the-job training","4"
"Probation officers and correctional treatment specialists    * Correctional Treatment Specialist* Juvenile Probation Officer* Parole Agent* Parole Officer* Probation Officer","=""21-1092""","92.7","96.2","3.5","3.8","8.1","55,690","Bachelor's degree","3","None","4","Short-term on-the-job training","5"
"Procurement clerks    * Procurement Assistant* Procurement Clerk* Purchasing Assistant* Purchasing Clerk","=""43-3061""","63.0","59.8","-3.2","-5.1","5.2","44,740","High school diploma or equivalent","7","None","4","Moderate-term on-the-job training","4"
"Producers and directors    * Broadcast Producer* Casting Director* Film Maker* Independent Film Maker* Independent Video Producer* Motion Picture Director* Movie Producer* Music Video Director* Music Video Producer* News Production Supervisor* Newscast Director* Newscast Producer* On-Air Director* Pageant Director* Radio Producer* Radio Television Technical Director* Stage Manager* Television News Producer* Television Newscast Director* Television Producer* Television Program Director* Theater Company Producer* Video Producer","=""27-2012""","131.0","162.5","31.6","24.1","15.6","76,400","Bachelor's degree","3","Less than 5 years","2","None","6"
"Production workers, all other","=""51-9199""","203.6","220.3","16.7","8.2","24.6","31,420","High school diploma or equivalent","7","None","4","Moderate-term on-the-job training","4"
"Production, planning, and expediting clerks    * Expeditor* Material Control Clerk* Material Expediter* Mill Recorder* Production Control Clerk* Production Control Coordinating Clerk* Production Control Coordinator* Production Scheduler* Work Ticket Distributor","=""43-5061""","365.7","393.6","27.9","7.6","41.0","49,640","High school diploma or equivalent","7","None","4","Moderate-term on-the-job training","4"
"Project management specialists and business operations specialists, all other","=""13-1198""","1,777.3","1,876.5","99.2","5.6","141.9","77,420","Bachelor's degree","3","None","4","None","6"
"Proofreaders and copy markers    * Braille Proofreader* Clerical Proofreader* Copy Reader* Editorial Assistant* Format Proofreader* Proofreader","=""43-9081""","7.9","8.3","0.4","5.3","1.1","41,140","Bachelor's degree","3","None","4","None","6"
"Property appraisers and assessors","=""13-2020""","78.7","82.1","3.4","4.4","6.3","58,650","Bachelor's degree","3","None","4","Long-term on-the-job training","3"
"Property, real estate, and community association managers    * Apartment Manager* Building Rental Manager* Community Association Manager* Condominium Association Manager* Homeowner Association Manager* Land Acquisition Manager* Leasing Property Manager* Property Manager* Real Estate Manager","=""11-9141""","364.1","375.5","11.4","3.1","29.1","59,660","High school diploma or equivalent","7","Less than 5 years","2","None","6"
"Prosthodontists    * Maxillofacial Prosthetics Dentist* Maxillofacial Prosthodontist* Prosthodontist* Reconstructive Dentist","=""29-1024""","0.7","0.7","0.1","8.5","0.0",">=208,000","Doctoral or professional degree","1","None","4","Internship/residency","1"
"Psychiatric aides","=""31-1133""","54.1","58.1","4.0","7.4","7.2","31,570","High school diploma or equivalent","7","None","4","Short-term on-the-job training","5"
"Psychiatric technicians    * Behavioral Health Technician* Mental Health Technician* Psychiatric Technician","=""29-2053""","91.6","103.3","11.7","12.8","8.0","35,030","Postsecondary nondegree award","5","Less than 5 years","2","Short-term on-the-job training","5"
"Psychiatrists","=""29-1223""","28.1","31.6","3.5","12.5","1.2",">=208,000","Doctoral or professional degree","1","None","4","Internship/residency","1"
"Psychologists, all other    * Developmental Psychologist* Experimental Psychologist* Forensic Psychologist* Neuropsychologist* Psychometrist* Psychotherapist* Rehabilitation Psychologist* Social Psychologist* Sports Psychologist","=""19-3039""","55.2","56.3","1.1","2.0","3.7","105,780","Master's degree","2","None","4","Internship/residency","1"
"Psychology teachers, postsecondary    * Applied Psychology Professor* Child Development Professor* Clinical Psychology Professor* Educational Psychology Professor* Human Relations Professor* Industrial Psychology Professor* Industrial/Organizational Psychology Professor* Psychology Professor","=""25-1066""","44.1","48.6","4.5","10.3","4.7","78,180","Doctoral or professional degree","1","None","4","None","6"
"Public relations and fundraising managers","=""11-2030""","89.0","100.3","11.3","12.6","8.9","118,430","Bachelor's degree","3","5 years or more","1","None","6"
"Public relations specialists    * Environmental Communications Specialist* Lobbyist* Media Relations Specialist* Press Agent* Press Secretary* Public Affairs Officer* Public Relations Counselor* Public Relations Officer* Public Relations Representative* Publicist* Publicity Agent* Publicity Writer","=""27-3031""","272.3","303.4","31.2","11.4","29.2","62,810","Bachelor's degree","3","None","4","None","6"
"Public safety telecommunicators    * 911 Dispatcher* 911 Operator* Ambulance Dispatcher* Emergency Communications Dispatcher* Emergency Communications Operator* Emergency Operator* Emergency Telecommunications Dispatcher* Fire Dispatcher* Police Dispatcher* Police Radio Dispatcher","=""43-5031""","95.4","103.2","7.8","8.2","9.8","43,290","High school diploma or equivalent","7","None","4","Moderate-term on-the-job training","4"
"Pump operators, except wellhead pumpers    * Acid Pump Operator* Brewery Pumper* Concrete Pump Operator* Fluid Pump Operator","=""53-7072""","11.1","12.5","1.4","12.6","1.4","48,090","High school diploma or equivalent","7","None","4","Moderate-term on-the-job training","4"
"Purchasing managers    * Contract Administrator* Contracting Manager* Director of Strategic Sourcing* Procurement Manager* Purchasing Director* Purchasing Manager* Sourcing Manager","=""11-3061""","74.4","79.0","4.6","6.1","6.3","125,940","Bachelor's degree","3","5 years or more","1","None","6"
"Radiation therapists    * Dosimetrist* Radiation Therapist* Radiation Therapy Technologist* Registered Radiation Therapist","=""29-1124""","17.7","19.3","1.6","9.1","1.1","86,850","Associate's degree","4","None","4","None","6"
"Radio, cellular, and tower equipment installers and repairers    * Radio Frequency Technician* Radio Mechanic* Radio Repairer* Two-Way Radio Technician","=""49-2021""","13.5","14.1","0.5","3.9","1.6","57,720","Associate's degree","4","None","4","Moderate-term on-the-job training","4"
"Radiologic technologists and technicians    * Computed Axial Tomography Technologist* Computed Tomography (CT) Scanner Operator* Radiologic Technician* Registered Radiologic Technologist* Skiagrapher* X-Ray Technician","=""29-2034""","212.1","230.3","18.3","8.6","17.4","61,900","Associate's degree","4","None","4","None","6"
"Rail car repairers    * Freight Car Repairer* Mine Car Mechanic* Rail Car Maintenance Mechanic* Rail Car Mechanic* Streetcar Repairer* Subway Car Repairer* Tank Car Reconditioner* Trolley Car Mechanic* Trolley Car Overhauler","=""49-3043""","21.1","22.2","1.1","5.2","2.2","57,710","High school diploma or equivalent","7","None","4","Long-term on-the-job training","3"
"Rail transportation workers, all other    * Railway Equipment Operator* Retarder Operator* Transfer Table Operator","=""53-4099""","1.7","1.7","0.0","2.6","0.2","47,970","High school diploma or equivalent","7","None","4","Moderate-term on-the-job training","4"
"Rail yard engineers, dinkey operators, and hostlers    * Coal Tram Driver* Dinkey Driver* Dinkey Operator* Engine Hostler* Haulage Engine Operator* Railcar Switcher* Yard Hostler","=""53-4013""","4.2","4.3","0.0","0.8","0.4","51,720","High school diploma or equivalent","7","None","4","Moderate-term on-the-job training","4"
"Rail-track laying and maintenance equipment operators    * Ballast Cleaning Machine Operator* Rail Maintenance Worker* Railroad Track Mechanic* Track Layer* Track Machine Operator* Track Maintainer* Track Moving Machine Operator* Track Repair Worker* Track Repairer* Track Service Worker* Track Surfacing Machine Operator* Trackwalker","=""47-4061""","15.7","16.5","0.8","5.3","1.5","56,370","High school diploma or equivalent","7","None","4","Moderate-term on-the-job training","4"
"Railroad brake, signal, and switch operators and locomotive firers","=""53-4022""","11.0","11.3","0.2","2.0","1.0","57,870","High school diploma or equivalent","7","None","4","Moderate-term on-the-job training","4"
"Railroad conductors and yardmasters    * Freight Conductor* Passenger Car Conductor* Train Conductor* Yard Conductor","=""53-4031""","32.9","34.7","1.8","5.5","3.1","64,030","High school diploma or equivalent","7","None","4","Moderate-term on-the-job training","4"
"Real estate brokers    * Licensed Real Estate Broker* Real Estate Broker","=""41-9021""","109.9","114.8","4.9","4.5","10.1","60,370","High school diploma or equivalent","7","Less than 5 years","2","None","6"
"Real estate sales agents    * Agricultural Real Estate Agent* Apartment Rental Agent* Industrial Real Estate Agent* Land Sales Agent* Right of Way Agent","=""41-9022""","408.9","425.8","16.9","4.1","37.4","49,040","High school diploma or equivalent","7","None","4","Moderate-term on-the-job training","4"
"Receptionists and information clerks    * Appointment Clerk* Dental Receptionist* Front Desk Receptionist* Land Leasing Information Clerk","=""43-4171""","1,016.2","1,060.0","43.8","4.3","134.0","31,110","High school diploma or equivalent","7","None","4","Short-term on-the-job training","5"
