"Forensic science technicians    * Ballistic Technician* Ballistician* Ballistics Expert* Crime Lab Technician* Crime Scene Technician* Criminalist Technician* Fingerprint Expert* Forensic Analyst* Forensic Science Technician* Handwriting Expert* Trace Evidence Technician* Wildlife Forensic Geneticist","=""19-4092""","17.2","19.8","2.7","15.6","2.5","60,590","Bachelor's degree","3","None","4","Moderate-term on-the-job training","4"
"Forest and conservation technicians","=""19-4071""","33.0","33.3","0.2","0.7","4.0","38,940","Associate's degree","4","None","4","None","6"
"Forest and conservation workers    * Forest Nursery Worker* Forester Aide* Forestry Laborer* Rangelands Conservation Laborer* Reforestation Worker* Seedling Puller* Wetlands Conservation Laborer","=""45-4011""","12.6","11.6","-1.0","-8.0","1.8","30,640","High school diploma or equivalent","7","None","4","Moderate-term on-the-job training","4"
"Forest fire inspectors and prevention specialists    * Environmental Protection Fire Control Officer* Fire Control Officer* Fire Operations Forester* Fire Ranger* Forest Fire Control Officer* Forest Fire Officer* Wildfire Prevention Specialist* Wildland Fire Operations Specialist","=""33-2022""","3.0","3.7","0.7","23.9","0.4","42,150","High school diploma or equivalent","7","Less than 5 years","2","Moderate-term on-the-job training","4"
"Foresters    * Environmental Protection Forester* Forest Ecologist* Forestry Scientist* Land Management Forester* Operations Forester* Resource Forester* Service Forester* Timber Management Specialist* Urban Forester","=""19-1032""","13.7","15.1","1.4","10.0","1.4","63,980","Bachelor's degree","3","None","4","None","6"
"Forestry and conservation science teachers, postsecondary    * Ecology Professor* Environmental Conservation Professor* Forest Biometrics Professor* Forest Ecology Professor* Forest Management Professor* Forest Pathology Professor* Forest Resources Professor* Forest Technology Professor* Silviculture Professor* Timber Management Professor* Wildlife Conservation Professor","=""25-1043""","1.7","1.8","0.1","5.5","0.2","87,400","Doctoral or professional degree","1","None","4","None","6"
"Forging machine setters, operators, and tenders, metal and plastic    * Cold Header Operator* Forging Roll Operator* Header Setup Operator* Spike Machine Operator* Swager Operator* Swaging Machine Operator","=""51-4022""","13.7","11.9","-1.8","-13.2","1.1","41,430","High school diploma or equivalent","7","None","4","Moderate-term on-the-job training","4"
"Foundry mold and coremakers    * Airset Caster* Airset Molder* Core Stripper* Foundry Molder* Green Sand Molder* No Bake Molder* Sand Molder* Wax Pattern Coater","=""51-4071""","15.8","15.3","-0.5","-3.3","1.5","37,140","High school diploma or equivalent","7","None","4","Moderate-term on-the-job training","4"
"Fundraisers    * Campaign Fundraiser* Donor Relations Officer* Fundraising Officer","=""13-1131""","101.3","117.5","16.1","15.9","12.0","59,610","Bachelor's degree","3","None","4","None","6"
"Funeral attendants    * Funeral Assistant* Funeral Attendant* Funeral Greeter* Funeral Home Assistant* Funeral Home Associate* Mortician Helper* Pallbearer* Undertaker Helper","=""39-4021""","42.3","43.7","1.4","3.3","5.8","29,150","High school diploma or equivalent","7","None","4","Short-term on-the-job training","5"
"Funeral home managers","=""11-9171""","12.5","12.9","0.4","3.2","1.0","74,200","Associate's degree","4","Less than 5 years","2","None","6"
"Furnace, kiln, oven, drier, and kettle operators and tenders    * Calciner Operator* Dry Kiln Operator* Induction Furnace Operator* Lime Kiln Operator* Lumber Kiln Operator* Rubber Curer* Soap Drier Tender* Tunnel Kiln Operator","=""51-9051""","17.8","18.7","0.9","4.9","1.8","40,670","High school diploma or equivalent","7","None","4","Moderate-term on-the-job training","4"
"Furniture finishers    * Cabinet Finisher* Furniture Refinisher* Furniture Sander* Piano Refinisher* Wood Cabinet Finisher","=""51-7021""","18.1","19.1","1.0","5.8","2.6","32,970","High school diploma or equivalent","7","None","4","Short-term on-the-job training","5"
"Gambling and sports book writers and runners    * Betting Clerk* Bookie* Casino Floor Runner* Keno Runner* Keno Writer* Race Book Writer* Race and Sports Book Writer* Sports Book Board Attendant* Sportsbook Ticket Writer","=""39-3012""","8.0","10.3","2.3","28.5","1.5","25,220","High school diploma or equivalent","7","None","4","Short-term on-the-job training","5"
"Gambling cage workers    * Cage Cashier* Casino Cage Cashier* Casino Cashier* Gaming Cage Cashier* Gaming Cashier","=""43-3041""","11.3","13.5","2.2","19.5","1.5","28,650","High school diploma or equivalent","7","None","4","Short-term on-the-job training","5"
"Gambling change persons and booth cashiers    * Mutuel Teller* Slot Attendant","=""41-2012""","14.7","17.3","2.7","18.1","3.2","27,080","No formal educational credential","8","None","4","Short-term on-the-job training","5"
"Gambling dealers    * 21 Dealer* Blackjack Dealer* Casino Dealer* Casino Games Dealer* Craps Dealer* Keno Dealer* Poker Dealer* Roulette Dealer* Table Games Dealer","=""39-3011""","74.1","91.9","17.8","24.0","13.8","23,740","High school diploma or equivalent","7","None","4","Short-term on-the-job training","5"
"Gambling managers    * Bingo Manager* Casino Manager* Gaming Department Head* Gaming Director* Gaming Manager* Slot Operations Director* Slots Manager* Table Games Manager","=""11-9071""","3.9","4.7","0.8","20.1","0.4","75,470","High school diploma or equivalent","7","Less than 5 years","2","None","6"
"Gambling service workers, all other    * Card Table Attendant* Pit Clerk* Poker Prop Player* Proposition Player* Shill","=""39-3019""","9.2","11.7","2.5","27.2","1.8","29,360","High school diploma or equivalent","7","None","4","Short-term on-the-job training","5"
"Gambling surveillance officers and gambling investigators    * Casino Investigator* Casino Surveillance Officer* Gambling Monitor* Gaming Surveillance Observer* Gaming Surveillance Officer","=""33-9031""","8.7","10.1","1.4","15.5","1.4","35,300","High school diploma or equivalent","7","Less than 5 years","2","Moderate-term on-the-job training","4"
"Gas compressor and gas pumping station operators    * Acetylene Gas Compressor* Butane Compressor Operator* Compressor Station Operator* Gas Compressor Operator* Gas Cylinder Processor* Gas Storage Operator* High Pressure Compressed Gas Filler* LNG Plant Operator* Liquid Natural Gas Plant Operator","=""53-7071""","4.1","4.0","-0.1","-1.4","0.4","67,840","High school diploma or equivalent","7","None","4","Moderate-term on-the-job training","4"
"Gas plant operators    * Gas Controller* Gas Plant Dispatcher* Gas Plant Operator* Gas Plant Technician* Natural Gas Plant Technician","=""51-8092""","15.1","14.8","-0.3","-1.8","1.5","72,970","High school diploma or equivalent","7","None","4","Long-term on-the-job training","3"
"General and operations managers    * Department Store General Manager* General Manager* General Superintendent* Manufacturing Operations Manager* Operations Manager* Radio Station Manager* Television Station Manager","=""11-1021""","2,411.9","2,638.2","226.3","9.4","229.6","103,650","Bachelor's degree","3","5 years or more","1","None","6"
"General internal medicine physicians","=""29-1216""","55.5","55.1","-0.4","-0.7","1.5",">=208,000","Doctoral or professional degree","1","None","4","Internship/residency","1"
"Genetic counselors    * Certified Genetic Counselor* Chromosomal Disorders Counselor* Genetic Counselor* Mitochondrial Disorders Counselor* Prenatal Genetic Counselor","=""29-9092""","2.4","3.1","0.6","26.2","0.3","85,700","Master's degree","2","None","4","None","6"
"Geographers    * Biogeographer* Economic Geographer* GIS Geographer* Geographer* Geomorphologist* Glaciologist* Physical Geographer* Political Geographer","=""19-3092""","1.6","1.7","0.0","1.1","0.1","85,430","Bachelor's degree","3","None","4","None","6"
"Geography teachers, postsecondary    * Cartography Professor* GIS Professor* Geographic Information Systems Professor* Geomatics Professor","=""25-1064""","4.4","4.7","0.3","6.3","0.4","82,330","Doctoral or professional degree","1","None","4","None","6"
"Geological and hydrologic technicians","=""19-4045""","16.8","18.3","1.5","8.7","2.3","50,630","Associate's degree","4","None","4","Moderate-term on-the-job training","4"
"Geoscientists, except hydrologists and geographers    * Crystallographer* Development Geologist* Environmental Geologist* Exploration Geologist* Geochemist* Geodesist* Geologist* Geomagnetist* Geophysicist* Geoscientist* Mine Geologist* Mineralogist* Mining Production Geologist* Oceanographer* Oceanologist* Paleontologist* Petroleum Geologist* Petrologist* Research Geologist* Sedimentationist* Seismologist* Stratigrapher* Volcanologist","=""19-2042""","29.0","31.0","2.0","7.0","3.1","93,580","Bachelor's degree","3","None","4","None","6"
"Glaziers    * Leaded Glass Installer* Plate Glass Installer* Stained Glass Glazier* Stained Glass Installer* Stained Glass Joiner* Window Glazier","=""47-2121""","53.6","56.1","2.5","4.7","6.0","46,080","High school diploma or equivalent","7","None","4","Apprenticeship","2"
"Graders and sorters, agricultural products    * Apple Sorter* Cherry Sorter* Cotton Grader* Egg Grader* Fruit Sorter* Meat Grader* Oyster Sorter* Peanut Grader* Potato Sorter* Seed Sorter* Strawberry Sorter* Vegetable Sorter* Wool Grader","=""45-2041""","32.5","32.1","-0.5","-1.4","4.7","28,220","No formal educational credential","8","None","4","Short-term on-the-job training","5"
"Graphic designers    * Catalogue Illustrator* Graphic Artist* Graphic Designer* Visual Designer","=""27-1024""","254.1","261.4","7.3","2.9","23.9","53,380","Bachelor's degree","3","None","4","None","6"
"Grinding and polishing workers, hand    * Hand Buffer* Hand Sander* Jewelry Grinder* Jewelry Polisher* Knife Grinder* Ring Polisher","=""51-9022""","23.7","20.5","-3.2","-13.6","2.1","31,750","No formal educational credential","8","None","4","Moderate-term on-the-job training","4"
"Grinding, lapping, polishing, and buffing machine tool setters, operators, and tenders, metal and plastic    * Aluminum Polisher* Deburring Machine Operator* Jewel Bearing Facer* Metal Grinder* Tool Polishing Machine Operator","=""51-4033""","69.4","67.1","-2.3","-3.3","7.5","36,880","High school diploma or equivalent","7","None","4","Moderate-term on-the-job training","4"
"Grounds maintenance workers, all other    * Trail Construction Worker* Trail Maintenance Worker* Trailhead Construction Worker* Trailhead Maintenance Worker* Tree Trimmer Helper","=""37-3019""","15.3","16.6","1.3","8.6","2.2","34,210","No formal educational credential","8","None","4","Short-term on-the-job training","5"
"Hairdressers, hairstylists, and cosmetologists    * Beautician* Cosmetologist* Funeral Home Makeup Artist* Hair Colorist* Hair Stylist* Hair and Makeup Designer* Hairdresser* Hairpiece Stylist* Wedding Makeup Artist* Wig Stylist","=""39-5012""","569.6","680.1","110.5","19.4","78.9","27,380","Postsecondary nondegree award","5","None","4","None","6"
"Hazardous materials removal workers    * Asbestos Abatement Worker* Asbestos Remover* Decontamination Worker* Hazard Waste Handler* Hazmat Technician* Irradiated Fuel Handler* Lead Abatement Worker* Radiological Control and Safety Technician","=""47-4041""","44.5","47.4","2.9","6.6","5.8","45,270","High school diploma or equivalent","7","None","4","Moderate-term on-the-job training","4"
"Health and safety engineers, except mining safety engineers and inspectors    * Fire Prevention Engineer* Fire Protection Engineer* Industrial Safety Engineer* Product Safety Engineer* Product Safety Test Engineer* System Safety Engineer","=""17-2111""","24.1","25.6","1.5","6.1","1.7","94,240","Bachelor's degree","3","None","4","None","6"
"Health education specialists    * Certified Diabetes Educator* Certified Health Education Specialist* Community Health Education Coordinator* Diabetes Educator* Health Education Specialist* Health Educator* Public Health Educator","=""21-1091""","61.1","68.7","7.6","12.4","7.4","56,500","Bachelor's degree","3","None","4","None","6"
"Health information technologists, medical registrars, surgical assistants, and healthcare practitioners and technical workers, all other","=""29-9098""","81.4","89.9","8.6","10.5","6.9","51,840","Postsecondary nondegree award","5","None","4","None","6"
"Health specialties teachers, postsecondary    * Clinical Laboratory Science Professor* Clinical Sciences Professor* Dentistry Professor* Gastroenterology Professor* Neurology Professor* Nutrition Professor* Occupational Therapy Professor* Optometry Professor* Pharmacology Professor* Physical Therapy Professor* Podiatric Medicine Professor* Podiatry Professor* Public Health Professor","=""25-1071""","242.7","301.6","58.9","24.3","30.8","99,090","Doctoral or professional degree","1","Less than 5 years","2","None","6"
"Healthcare social workers    * AIDS Social Worker* C-SWHC* Certified Social Workers In Health Care* Healthcare Social Worker* Hospice Home Care Social Worker* Hospice Social Worker* Hospital Social Worker* Medical Social Worker* Neonatal Social Worker* Nephrology Social Worker* Oncology Social Worker* Pediatric Social Worker* Public Health Social Worker* Renal Social Worker","=""21-1022""","184.9","209.3","24.4","13.2","20.4","57,630","Master's degree","2","None","4","Internship/residency","1"
"Healthcare support workers, all other    * Ortho/Prosthetic Aide","=""31-9099""","100.5","111.0","10.6","10.5","13.9","39,530","High school diploma or equivalent","7","None","4","None","6"
"Hearing aid specialists    * Hearing Aid Fitter* Hearing Aid Technician* Hearing Instrument Specialist","=""29-2092""","8.0","8.9","0.9","11.3","0.7","52,630","High school diploma or equivalent","7","None","4","Moderate-term on-the-job training","4"
"Heat treating equipment setters, operators, and tenders, metal and plastic    * Annealing Furnace Operator* Carburizing Furnace Operator* Flame Hardening Machine Setter* Heat Treater Apprentice* Heat Treating Furnace Tender* Induction Machine Setter* Wire Annealer* Wire Temperer","=""51-4191""","16.9","16.2","-0.7","-4.0","1.6","39,530","High school diploma or equivalent","7","None","4","Moderate-term on-the-job training","4"
"Heating, air conditioning, and refrigeration mechanics and installers    * Air Conditioning Service Technician* Bulk Cooler Installer* Evaporative Cooler Installer* Furnace Converter* Furnace Fitter* Gas Furnace Installer* Heating, Ventilation, and Air Conditioning (HVAC) Mechanic* Oil Burner Repairer* Oil Furnace Installer* Refrigeration Systems Installer* Stoker Installer","=""49-9021""","380.4","399.4","19.0","5.0","38.5","50,590","Postsecondary nondegree award","5","None","4","Long-term on-the-job training","3"
"Heavy and tractor-trailer truck drivers    * Auto Carrier Driver* Cement Truck Driver* Concrete Mixer Driver* Concrete Mixer Truck Driver* Fuel Truck Driver* Garbage Truck Driver* Line Haul Driver* Logging Truck Driver* Moving Van Driver* Over-the-Road Driver* Semi-Truck Driver* Tanker Driver* Tow Truck Operator","=""53-3032""","1,951.6","2,073.6","122.1","6.3","231.1","47,130","Postsecondary nondegree award","5","None","4","Short-term on-the-job training","5"
"Helpers, construction trades, all other    * Boiler Coverer Helper* Bridge Ironworker Helper* Carpet Layer Helper* Cellulose Insulation Helper* Construction Ironworker Helper* Cork Insulator Helper* Drywall Hanger Helper* Drywall Stripper Helper* Drywall Taper Helper* HVAC Sheet Metal Installer Helper* Heat and Frost Insulator Helper* Linoleum Layer Helper* Ornamental Ironworker Helper* Pipe Insulator Helper* Plate Glass Installer Helper* Post Tensioning Ironworker Helper* Rod Buster Helper* Sheet Metal Duct Installer Helper* Sheet Rock Installation Helper* Sheet Rock Taper Helper* Stained Glass Glazier Helper* Terrazzo Finisher Helper* Terrazzo Layer Helper* Terrazzo Worker Helper* Trench Digger Helper* Wall Taper Helper* Window Glazier Helper","=""47-3019""","27.8","29.5","1.7","5.9","3.5","33,360","No formal educational credential","8","None","4","Short-term on-the-job training","5"
"Helpers--brickmasons, blockmasons, stonemasons, and tile and marble setters    * Adobe Layer Helper* Brick Carrier* Brick Washer* Bricklayer Helper* Ceramic Tile Installation Helper* Chimney Builder Helper* Firebrick Layer Helper* Marble Installation Helper* Mortar Mixer* Parquet Floor Layer's Helper* Refractory Tile Helper* Wood Tile Installation Helper","=""47-3011""","20.9","20.1","-0.8","-3.9","2.3","36,990","No formal educational credential","8","None","4","Short-term on-the-job training","5"
"Helpers--carpenters    * Beam Builder Helper* Building Carpenter Helper* Carpenter Assistant* Carpenter Helper* Construction Carpenters Helper* Hardwood Floor Installation Helper* House Carpenter Helper","=""47-3012""","31.0","31.2","0.2","0.7","3.7","34,280","No formal educational credential","8","None","4","Short-term on-the-job training","5"
"Helpers--electricians    * Electrical Sign Wirer Helper* Electrician's Assistant* House Wirer Helper* Marine Electrician Helper* Stage Electrician Helper* Utilities Ground Worker","=""47-3013""","75.5","76.2","0.7","0.9","8.9","33,840","High school diploma or equivalent","7","None","4","Short-term on-the-job training","5"
"Helpers--extraction workers    * Blaster Helper* Blasting Helper* Boring Machine Operator Helper* Continuous Miner Operator Helper* Driller Helper* Loading Machine Operator Helper* Longwall Machine Operator Helper* Mining Helper* Roof Bolter Helper* Rotary Drill Operator Helper* Shale Planer Operator Helper","=""47-5081""","12.6","15.5","2.9","23.0","1.9","37,860","High school diploma or equivalent","7","None","4","Moderate-term on-the-job training","4"
"Helpers--installation, maintenance, and repair workers    * Automobile Body Repairer Helper* Cable Splicer Helper* Hydroelectric Machinery Mechanic Helper* Locksmith Helper* Mechanic's Assistant* Meter Repairer Helper* Motorboat Mechanic Helper* Powerhouse Mechanic Helper* Streetcar Repairer Helper","=""49-9098""","92.9","99.8","6.9","7.4","12.9","31,760","High school diploma or equivalent","7","None","4","Short-term on-the-job training","5"
"Helpers--painters, paperhangers, plasterers, and stucco masons    * Billboard Poster Helper* Bridge Painter Helper* Dry Plasterer Helper* Highway Painter Helper* House Painter Helper* Ornamental Plasterer Helper* Plaster Tender* Ship Painter Helper* Swimming Pool Plasterer Helper* Wallpaper Hanger Helper* Wallpaperer Helper","=""47-3014""","9.4","10.0","0.6","6.8","1.2","31,640","No formal educational credential","8","None","4","Short-term on-the-job training","5"
"Helpers--pipelayers, plumbers, pipefitters, and steamfitters    * Gas Main Fitter Helper* Hydraulic Plumber Helper* Industrial Gas Fitter Helper* Marine Pipefitter Helper* Marine Steam Fitter Helper* Pipe Fitter Helper* Plumber Assistant* Plumber Helper* Sewer Pipe Layer Helper* Sprinkler Fitter Helper* Trench Pipe Layer Helper* Water Main Installer Helper","=""47-3015""","56.2","59.4","3.1","5.6","7.1","33,590","High school diploma or equivalent","7","None","4","Short-term on-the-job training","5"
"Helpers--production workers    * Blending Tank Helper* Commercial Baker Helper* Machinist Helper* Slitter Helper* Tailor Helper* Welder Helper* Woodworker Helper","=""51-9198""","238.0","227.2","-10.8","-4.5","31.8","30,500","High school diploma or equivalent","7","None","4","Short-term on-the-job training","5"
"Helpers--roofers    * Hot Tar Roofer Helper* Industrial Roofer Helper* Residential Roofer Helper* Roofer Assistant* Roofer Helper* Roofing Laborer* Shingles Roofer Helper* Slate Roofer Helper* Terra Cotta Roofer Helper","=""47-3016""","8.2","8.6","0.4","4.8","1.0","33,260","No formal educational credential","8","None","4","Short-term on-the-job training","5"
"Highway maintenance workers    * Highway Maintainer* Highway Maintenance Crew Worker* Highway Worker* Lane Marker Installer* Road Patcher* Road Sign Installer","=""47-4051""","153.8","163.1","9.3","6.0","17.1","41,660","High school diploma or equivalent","7","None","4","Moderate-term on-the-job training","4"
"Historians    * Genealogist* Historiographer* Protohistorian","=""19-3093""","3.1","3.3","0.2","5.5","0.3","63,100","Master's degree","2","None","4","None","6"
"History teachers, postsecondary    * African History Professor* American History Professor* Historiography Professor* Jewish History Professor* Russian History Professor* South Asian History Professor","=""25-1125""","24.4","26.3","1.9","7.9","2.5","76,890","Doctoral or professional degree","1","None","4","None","6"
"Hoist and winch operators    * Hoist Operator* Winch Derrick Operator* Winch Operator","=""53-7041""","5.0","5.2","0.2","3.4","0.6","62,610","No formal educational credential","8","None","4","Short-term on-the-job training","5"
"Home appliance repairers    * Certified Appliance Service Technician* Electric Stove Installer* Gas Appliance Repairer* Gas Appliance Servicer* Home Appliance Installer* Stove Installer* Vacuum Cleaner Repair Person* Vacuum Cleaner Repairer* Washing Machine Installer* Washing Machine Repairer* Window Air Conditioner Installer","=""49-9031""","31.6","30.4","-1.1","-3.6","2.9","41,610","High school diploma or equivalent","7","None","4","Moderate-term on-the-job training","4"
"Home health and personal care aides","=""31-1120""","3,470.7","4,600.6","1,129.9","32.6","599.8","27,080","High school diploma or equivalent","7","None","4","Short-term on-the-job training","5"
"Hosts and hostesses, restaurant, lounge, and coffee shop    * Bar Host/Hostess* Bar Hostess* Dining Room Host* Dining Room Host/Hostess* Maitre D'* Tearoom Host/Hostess* Tearoom Hostess","=""35-9031""","333.6","417.8","84.2","25.3","95.2","23,880","No formal educational credential","8","None","4","Short-term on-the-job training","5"
"Hotel, motel, and resort desk clerks    * Assistant Innkeeper* Hotel Desk Clerk* Hotel Front Desk Clerk* Hotel Registration Clerk* Motel Clerk* Motel Front Desk Attendant* Resort Desk Clerk","=""43-4081""","221.0","257.3","36.3","16.4","42.8","25,490","High school diploma or equivalent","7","None","4","Short-term on-the-job training","5"
"Human resources assistants, except payroll and timekeeping    * Employment Clerk* HR Clerk* Personnel Clerk","=""43-4161""","112.0","108.8","-3.2","-2.9","10.6","43,250","Associate's degree","4","None","4","None","6"
"Human resources managers    * Employee Relations Manager* Job Analysis Manager* Labor Relations Director* Personnel Administrator* Personnel Director* Personnel Manager* Position Description Manager","=""11-3121""","161.7","176.5","14.8","9.2","14.8","121,220","Bachelor's degree","3","5 years or more","1","None","6"
"Human resources specialists    * Corporate Recruiter* Credentialing Coordinator* Employee Placement Specialist* Human Resources Generalist* Job Placement Officer* Job Placement Specialist* Job Recruiter* Personnel Coordinator* Personnel Officer* Personnel Recruiter* Personnel Specialist* Staffing Coordinator","=""13-1071""","674.8","745.1","70.2","10.4","73.4","63,490","Bachelor's degree","3","None","4","None","6"
"Hydrologists    * Hydrogeologist* Hydrologist* Isotope Hydrologist* Surface Hydrologist","=""19-2043""","6.5","6.9","0.4","5.6","0.7","84,040","Bachelor's degree","3","None","4","None","6"
"Industrial engineering technologists and technicians    * Industrial Engineering Technician* Motion Study Technician* Production Control Technologist* Time Study Technician* Time Study Technologist","=""17-3026""","64.1","66.9","2.8","4.4","6.3","57,320","Associate's degree","4","None","4","None","6"
"Industrial engineers    * Efficiency Engineer* Manufacturing Engineer* Packaging Engineer* Production Engineer","=""17-2112""","292.0","332.0","40.0","13.7","23.3","88,950","Bachelor's degree","3","None","4","None","6"
"Industrial machinery mechanics    * Bag Machine Adjuster* Boilerhouse Mechanic* Foundry Equipment Mechanic* Hydroelectric Machinery Mechanic* Industrial Conveyor Belt Repairer* Loom Fixer* Loom Technician","=""49-9041""","391.8","475.3","83.6","21.3","45.1","55,490","High school diploma or equivalent","7","None","4","Long-term on-the-job training","3"
"Industrial production managers    * Industrial Production Manager* Manufacturing Director* Plant Chief* Plant Manager* Plant Superintendent* Production Control Manager","=""11-3051""","189.3","199.3","10.0","5.3","13.9","108,790","Bachelor's degree","3","5 years or more","1","None","6"
"Industrial truck and tractor operators    * Forklift Driver* Forklift Operator* Front-End Loader Operator* Hydraulic Lift Driver* Industrial Truck Operator* Reach-Lift Truck Driver* Stacker Operator","=""53-7051""","631.6","680.3","48.7","7.7","75.0","37,560","No formal educational credential","8","None","4","Short-term on-the-job training","5"
"Industrial-organizational psychologists    * Engineering Psychologist* Human Resources Psychologist* I/O Psychologist* Industrial Psychologist* Management Psychologist* Organizational Psychologist* Organizational Research Consultant* Personnel Research Psychologist","=""19-3032""","4.9","5.0","0.1","2.2","0.3","96,270","Master's degree","2","None","4","Internship/residency","1"
"Information and record clerks, all other    * Election Clerk* Flight Crew Scheduler* Probate Clerk* Student Admissions Clerk","=""43-4199""","159.9","168.1","8.2","5.1","18.3","42,820","High school diploma or equivalent","7","None","4","Short-term on-the-job training","5"
"Information security analysts","=""15-1212""","141.2","188.3","47.1","33.3","16.3","103,590","Bachelor's degree","3","Less than 5 years","2","None","6"
